{
  "accessibility": {
    "governance": {
      "approval": "approve-usage-core",
      "provenance": {
        "capturedAt": "2026-08-21T12:15:00Z",
        "method": "human-authored",
        "source": ".identity/brief.md"
      },
      "state": "approved",
      "subject": "usage:core-guidance",
      "visibility": "public"
    },
    "rules": [
      "Use reviewed contrast pairings",
      "Provide contextual alternative text",
      "Honor reduced motion",
      "Never encode state by color alone"
    ],
    "summary": "Identity expression must preserve perceivable content, readable text, operable controls, and understandable status without relying on brand styling alone."
  },
  "audience": "review",
  "characteristics": [
    {
      "description": "Lead with the useful outcome and make recovery paths concrete.",
      "governance": {
        "approval": "approve-voice-core",
        "provenance": {
          "capturedAt": "2026-08-21T12:10:00Z",
          "method": "human-authored",
          "source": ".identity/brief.md"
        },
        "state": "approved",
        "subject": "voice:core-guidance",
        "visibility": "public"
      },
      "id": "clear",
      "label": "Clear"
    },
    {
      "description": "Prefer evidence and precise limits over hype or vague certainty.",
      "governance": {
        "approval": "approve-voice-core",
        "provenance": {
          "capturedAt": "2026-08-21T12:10:00Z",
          "method": "human-authored",
          "source": ".identity/brief.md"
        },
        "state": "approved",
        "subject": "voice:core-guidance",
        "visibility": "public"
      },
      "id": "grounded",
      "label": "Grounded"
    },
    {
      "description": "Treat constraints and mistakes as shared design problems, never personal failures.",
      "governance": {
        "approval": "approve-voice-core",
        "provenance": {
          "capturedAt": "2026-08-21T12:10:00Z",
          "method": "human-authored",
          "source": ".identity/brief.md"
        },
        "state": "approved",
        "subject": "voice:core-guidance",
        "visibility": "public"
      },
      "id": "considerate",
      "label": "Considerate"
    }
  ],
  "contexts": [
    {
      "antiExamples": [
        {
          "governance": {
            "approval": "approve-voice-core",
            "provenance": {
              "capturedAt": "2026-08-21T12:10:00Z",
              "method": "human-authored",
              "source": ".identity/brief.md"
            },
            "state": "approved",
            "subject": "voice:core-guidance",
            "visibility": "public"
          },
          "id": "readme-vagueness",
          "rationale": "It names neither a concrete outcome nor the system's review boundary.",
          "text": "A flexible solution for all your branding needs."
        },
        {
          "governance": {
            "approval": "reject-hype-claim",
            "provenance": {
              "capturedAt": "2026-08-21T12:19:00Z",
              "method": "handoff-candidate",
              "source": "handoff:voice-hype-claim/v1"
            },
            "state": "rejected",
            "subject": "voice-example:hype-claim",
            "visibility": "internal"
          },
          "id": "hype-claim",
          "rationale": "Unprovable superlatives undermine the grounded voice.",
          "text": "The world's most revolutionary brand generator."
        }
      ],
      "audience": "A contributor deciding whether and how to use the repository.",
      "avoidedLanguage": [
        "magic",
        "revolutionary",
        "effortless",
        "guaranteed"
      ],
      "capitalization": "Use sentence case for headings and preserve registered product casing.",
      "characteristics": [
        "clear",
        "grounded",
        "considerate"
      ],
      "examples": [
        {
          "governance": {
            "approval": "approve-voice-core",
            "provenance": {
              "capturedAt": "2026-08-21T12:10:00Z",
              "method": "human-authored",
              "source": ".identity/brief.md"
            },
            "state": "approved",
            "subject": "voice:core-guidance",
            "visibility": "public"
          },
          "id": "readme-opening",
          "rationale": "It states the outcome, authority boundary, and recovery affordance without hype.",
          "text": "Generate a reviewed Brand Kit locally, then inspect exactly what changed."
        },
        {
          "governance": {
            "approval": null,
            "provenance": {
              "capturedAt": "2026-08-21T12:18:00Z",
              "method": "handoff-candidate",
              "source": "handoff:voice-friendly-candidate/v1"
            },
            "state": "candidate",
            "subject": "voice-example:friendly-candidate",
            "visibility": "internal"
          },
          "id": "friendly-candidate",
          "rationale": "A warmer option proposed through the creative handoff and awaiting review.",
          "text": "Your brand system, ready when you are."
        },
        {
          "governance": {
            "approval": "supersede-old-tagline",
            "provenance": {
              "capturedAt": "2025-02-01T10:00:00Z",
              "method": "imported",
              "source": "guidance:old-tagline/v0"
            },
            "state": "superseded",
            "subject": "voice-example:old-tagline",
            "visibility": "internal"
          },
          "id": "old-tagline",
          "rationale": "Retained as superseded migration history and excluded from current public copy.",
          "text": "Branding solved forever."
        }
      ],
      "governance": {
        "approval": "approve-voice-core",
        "provenance": {
          "capturedAt": "2026-08-21T12:10:00Z",
          "method": "human-authored",
          "source": ".identity/brief.md"
        },
        "state": "approved",
        "subject": "voice:core-guidance",
        "visibility": "public"
      },
      "id": "repository-readme",
      "intent": "Orient quickly, establish trust, and make the next action obvious.",
      "label": "Repository README",
      "naming": "Use the complete product name on first mention and the approved short name afterward.",
      "preferredVocabulary": [
        "reviewed",
        "local",
        "deterministic",
        "evidence",
        "recovery"
      ],
      "punctuation": "Prefer short declarative sentences; use exclamation points only for genuine celebration.",
      "tone": "Concise, capable, welcoming, and specific."
    },
    {
      "antiExamples": [
        {
          "governance": {
            "approval": "approve-voice-core",
            "provenance": {
              "capturedAt": "2026-08-21T12:10:00Z",
              "method": "human-authored",
              "source": ".identity/brief.md"
            },
            "state": "approved",
            "subject": "voice:core-guidance",
            "visibility": "public"
          },
          "id": "incident-dismissal",
          "rationale": "It minimizes impact and makes no verifiable commitment.",
          "text": "A few users may notice a minor issue; everything should be fine soon."
        }
      ],
      "audience": "A user affected by a service or release problem.",
      "avoidedLanguage": [
        "minor issue",
        "user error",
        "obviously",
        "soon"
      ],
      "capitalization": "Use sentence case and avoid all-caps urgency.",
      "characteristics": [
        "clear",
        "grounded",
        "considerate"
      ],
      "examples": [
        {
          "governance": {
            "approval": "approve-voice-core",
            "provenance": {
              "capturedAt": "2026-08-21T12:10:00Z",
              "method": "human-authored",
              "source": ".identity/brief.md"
            },
            "state": "approved",
            "subject": "voice:core-guidance",
            "visibility": "public"
          },
          "id": "incident-facts",
          "rationale": "It separates impact, continuity, and the next commitment.",
          "text": "Exports are delayed. Existing Brand Kits remain available. The next update is at 15:00 UTC."
        }
      ],
      "governance": {
        "approval": "approve-voice-core",
        "provenance": {
          "capturedAt": "2026-08-21T12:10:00Z",
          "method": "human-authored",
          "source": ".identity/brief.md"
        },
        "state": "approved",
        "subject": "voice:core-guidance",
        "visibility": "public"
      },
      "id": "incident-update",
      "intent": "State impact, known facts, next update, and recovery without deflection.",
      "label": "Incident update",
      "naming": "Name the affected capability exactly as it appears in the product.",
      "preferredVocabulary": [
        "impact",
        "confirmed",
        "investigating",
        "next update",
        "recovery"
      ],
      "punctuation": "Use periods and timestamps; avoid exclamation points and rhetorical questions.",
      "tone": "Calm, direct, accountable, and time-specific."
    }
  ],
  "decisions": [
    {
      "candidate": ".identity/sources/legacy-wordmark.svg",
      "evidence": "https://example.invalid/reviews/legacy-wordmark-source",
      "id": "approve-legacy-wordmark-source",
      "notes": "The source remains governed for migration and internal historical use.",
      "reviewedAt": "2025-02-01T10:00:00Z",
      "reviewedBy": "example-maintainer",
      "status": "approved",
      "subject": "legacy-wordmark",
      "supersedes": null
    },
    {
      "candidate": "asset:legacy-wordmark/v0",
      "evidence": "https://example.invalid/reviews/legacy-wordmark-v0",
      "id": "approve-legacy-wordmark-usage",
      "notes": "Historical use approval retained for the deprecation ledger.",